[
  {
    "id": "sets/aldurs-watchtower",
    "name": "items.set.aldurs-watchtower",
    "items": [
      "sets/aldurs-watchtower/helm",
      "sets/aldurs-watchtower/armor",
      "sets/aldurs-watchtower/boots",
      "sets/aldurs-watchtower/weapon"
    ],
    "bonuses": {
      "2": {
        "coreStats": {
          "strength": 15,
          "vitality": 15
        }
      },
      "3": {
        "statMods": {
          "attackSpeed": 40
        }
      },
      "4": {
        "coreStats": {
          "strength": 30,
          "vitality": 30,
          "energy": 20
        },
        "resistances": {
          "fire": 40,
          "cold": 40,
          "lightning": 40,
          "poison": 40
        },
        "statMods": {
          "life": 150,
          "defense": 120
        }
      }
    }
  },
  {
    "id": "sets/angelic-raiment",
    "name": "Angelic Raiment",
    "items": [
      "sets/angelic-raiment/amulet",
      "sets/angelic-raiment/ring",
      "sets/angelic-raiment/armor",
      "sets/angelic-raiment/weapon"
    ],
    "bonuses": {
      "2": {
        "coreStats": {
          "strength": 10
        }
      },
      "3": {
        "statMods": {
          "life": 60,
          "defense": 60
        }
      },
      "4": {
        "coreStats": {
          "strength": 20,
          "vitality": 20
        },
        "statMods": {
          "life": 120,
          "defense": 120,
          "attack": 200
        }
      }
    }
  },
  {
    "id": "sets/arcanna-tricks",
    "name": "Arcanna's Tricks",
    "items": [
      "sets/arcanna-tricks/helm",
      "sets/arcanna-tricks/weapon",
      "sets/arcanna-tricks/armor",
      "sets/arcanna-tricks/amulet"
    ],
    "bonuses": {
      "2": {
        "coreStats": {
          "energy": 15
        }
      },
      "3": {
        "statMods": {
          "mana": 80,
          "defense": 40
        }
      },
      "4": {
        "coreStats": {
          "energy": 25
        },
        "resistances": {
          "arcane": 20
        },
        "statMods": {
          "mana": 150,
          "attackSpeed": 20
        }
      }
    }
  },
  {
    "id": "sets/arctic-gear",
    "name": "Arctic Gear",
    "items": [
      "sets/arctic-gear/armor",
      "sets/arctic-gear/belt",
      "sets/arctic-gear/gloves",
      "sets/arctic-gear/helm"
    ],
    "bonuses": {
      "2": {
        "resistances": {
          "cold": 50
        }
      },
      "3": {
        "resistances": {
          "cold": 75
        },
        "statMods": {
          "defense": 80
        }
      },
      "4": {
        "resistances": {
          "fire": 30,
          "cold": 100
        },
        "statMods": {
          "defense": 150
        }
      }
    }
  },
  {
    "id": "sets/berserker-arsenal",
    "name": "Berserker's Arsenal",
    "items": [
      "sets/berserker-arsenal/helm",
      "sets/berserker-arsenal/armor",
      "sets/berserker-arsenal/weapon"
    ],
    "bonuses": {
      "2": {
        "coreStats": {
          "strength": 15
        }
      },
      "3": {
        "coreStats": {
          "strength": 25,
          "vitality": 20
        },
        "statMods": {
          "attack": 150,
          "attackSpeed": 30,
          "defense": 80
        }
      }
    }
  },
  {
    "id": "sets/bul-kathos-children",
    "name": "Bul-Kathos' Children",
    "items": [
      "sets/bul-kathos-children/weapon1",
      "sets/bul-kathos-children/weapon2"
    ],
    "bonuses": {
      "2": {
        "coreStats": {
          "strength": 40,
          "vitality": 30
        },
        "statMods": {
          "attackSpeed": 50,
          "life": 200,
          "attack": 300
        }
      }
    }
  },
  {
    "id": "sets/cathan-traps",
    "name": "Cathan's Traps",
    "items": [
      "sets/cathan-traps/ring",
      "sets/cathan-traps/amulet",
      "sets/cathan-traps/armor",
      "sets/cathan-traps/helm",
      "sets/cathan-traps/gloves"
    ],
    "bonuses": {
      "2": {
        "statMods": {
          "magicFind": 25
        }
      },
      "3": {
        "resistances": {
          "fire": 50
        }
      },
      "4": {
        "resistances": {
          "fire": 55
        },
        "statMods": {
          "magicFind": 35
        }
      },
      "5": {
        "coreStats": {
          "strength": 20,
          "dexterity": 20
        },
        "resistances": {
          "fire": 60
        },
        "statMods": {
          "magicFind": 50
        }
      }
    }
  },
  {
    "id": "sets/civerb-vestments",
    "name": "Civerb's Vestments",
    "items": [
      "sets/civerb-vestments/weapon",
      "sets/civerb-vestments/shield",
      "sets/civerb-vestments/amulet"
    ],
    "bonuses": {
      "2": {
        "statMods": {
          "attack": 100
        }
      },
      "3": {
        "statMods": {
          "attack": 150,
          "magicFind": 25
        }
      }
    }
  },
  {
    "id": "sets/cleglaw-brace",
    "name": "Cleglaw's Brace",
    "items": [
      "sets/cleglaw-brace/weapon",
      "sets/cleglaw-brace/shield",
      "sets/cleglaw-brace/gloves"
    ],
    "bonuses": {
      "2": {
        "statMods": {
          "attack": 80
        }
      },
      "3": {
        "statMods": {
          "physDodge": 15,
          "defense": 50,
          "attack": 150
        }
      }
    }
  },
  {
    "id": "sets/cow-king-leathers",
    "name": "Cow King's Leathers",
    "items": [
      "sets/cow-king-leathers/helm",
      "sets/cow-king-leathers/armor",
      "sets/cow-king-leathers/boots"
    ],
    "bonuses": {
      "2": {
        "coreStats": {
          "strength": 15
        }
      },
      "3": {
        "coreStats": {
          "strength": 25,
          "vitality": 20
        },
        "statMods": {
          "defense": 120,
          "magicFind": 40
        }
      }
    }
  },
  {
    "id": "sets/death-disguise",
    "name": "Death's Disguise",
    "items": [
      "sets/death-disguise/sash",
      "sets/death-disguise/gloves",
      "sets/death-disguise/armor"
    ],
    "bonuses": {
      "2": {
        "coreStats": {
          "dexterity": 15
        }
      },
      "3": {
        "resistances": {
          "poison": 50
        },
        "statMods": {
          "life": 60,
          "defense": 80
        }
      }
    }
  },
  {
    "id": "sets/disciple",
    "name": "Disciple",
    "items": [
      "sets/disciple/helm",
      "sets/disciple/armor",
      "sets/disciple/amulet",
      "sets/disciple/ring",
      "sets/disciple/boots",
      "sets/disciple/belt",
      "sets/disciple/gloves"
    ],
    "bonuses": {
      "2": {
        "coreStats": {
          "vitality": 10
        }
      },
      "3": {
        "coreStats": {
          "vitality": 15
        },
        "statMods": {
          "life": 60
        }
      },
      "4": {
        "resistances": {
          "fire": 20,
          "cold": 20,
          "lightning": 20,
          "poison": 20
        }
      },
      "5": {
        "statMods": {
          "defense": 120,
          "life": 100
        }
      },
      "6": {
        "coreStats": {
          "strength": 20,
          "dexterity": 20
        }
      },
      "7": {
        "coreStats": {
          "strength": 30,
          "vitality": 30
        },
        "resistances": {
          "fire": 30,
          "cold": 30,
          "lightning": 30,
          "poison": 30,
          "arcane": 30
        },
        "statMods": {
          "life": 200,
          "defense": 200,
          "magicFind": 40
        }
      }
    }
  },
  {
    "id": "sets/griswolds-legacy",
    "name": "items.set.griswolds-legacy",
    "items": [
      "sets/griswolds-legacy/helm",
      "sets/griswolds-legacy/armor",
      "sets/griswolds-legacy/shield",
      "sets/griswolds-legacy/weapon"
    ],
    "bonuses": {
      "2": {
        "statMods": {
          "defense": 100,
          "attackSpeed": 20
        }
      },
      "3": {
        "resistances": {
          "fire": 40,
          "cold": 40,
          "lightning": 40,
          "poison": 40
        }
      },
      "4": {
        "coreStats": {
          "strength": 30,
          "vitality": 30
        },
        "resistances": {
          "fire": 60,
          "cold": 60,
          "lightning": 60,
          "poison": 60
        },
        "statMods": {
          "defense": 200
        }
      }
    }
  },
  {
    "id": "sets/heaven-brethren",
    "name": "Heaven's Brethren",
    "items": [
      "sets/heaven-brethren/helm",
      "sets/heaven-brethren/armor",
      "sets/heaven-brethren/weapon",
      "sets/heaven-brethren/shield"
    ],
    "bonuses": {
      "2": {
        "statMods": {
          "defense": 80
        }
      },
      "3": {
        "resistances": {
          "fire": 20,
          "cold": 20,
          "lightning": 20,
          "poison": 20
        }
      },
      "4": {
        "coreStats": {
          "strength": 25,
          "vitality": 20
        },
        "statMods": {
          "defense": 200,
          "attack": 200
        }
      }
    }
  },
  {
    "id": "sets/hsarus-defense",
    "name": "Hsarus' Defense",
    "items": [
      "sets/hsarus-defense/belt",
      "sets/hsarus-defense/boots",
      "sets/hsarus-defense/shield"
    ],
    "bonuses": {
      "2": {
        "resistances": {
          "fire": 25,
          "cold": 25
        }
      },
      "3": {
        "coreStats": {
          "vitality": 20
        },
        "statMods": {
          "defense": 100
        }
      }
    }
  },
  {
    "id": "sets/hwanin-majesty",
    "name": "Hwanin's Majesty",
    "items": [
      "sets/hwanin-majesty/helm",
      "sets/hwanin-majesty/armor",
      "sets/hwanin-majesty/weapon",
      "sets/hwanin-majesty/belt"
    ],
    "bonuses": {
      "2": {
        "statMods": {
          "attackSpeed": 20
        }
      },
      "3": {
        "resistances": {
          "cold": 30,
          "lightning": 30
        }
      },
      "4": {
        "coreStats": {